{
  "version": 1,
  "shard": "a-rust-cli-and-proof-components-plan",
  "sources": [
    "docs/architect/host-invocation-routing/rust-cli-and-proof-components-plan.md"
  ],
  "files": [
    {
      "path": "docs/architect/host-invocation-routing/rust-cli-and-proof-components-plan.md",
      "disposition": "merge",
      "rationale": "Most claim units are carried (merge/split/supersede) by the host-invocation-routing release-boundaries, verification, contract and architecture documents, but the P0-P7 phase-level steps, gates, commands, performance budgets, delivery graph, risk register and revertible-slice list are not carried; those units are recorded unknown-blocking.",
      "targets": [
        "docs/platform/host-invocation-routing/architecture/release-boundaries.md",
        "docs/platform/host-invocation-routing/verification/r1-rust-host-proof.md",
        "docs/platform/host-invocation-routing/verification/compatibility-harness.md",
        "docs/platform/host-invocation-routing/contracts/legacy-payload.md",
        "docs/platform/host-invocation-routing/verification/r2-external-process-proof.md",
        "docs/platform/host-invocation-routing/verification/r3-remote-peer-proof.md",
        "docs/platform/host-invocation-routing/roadmap.md",
        "docs/platform/host-invocation-routing/spec.md",
        "docs/platform/host-invocation-routing/architecture/node-to-rust-migration.md",
        "docs/platform/host-invocation-routing/architecture/invocation-kernel.md",
        "docs/platform/host-invocation-routing/architecture/legacy-cli-transition.md"
      ]
    }
  ],
  "claims": [
    {
      "claimId": "claim_15bf45a3b2bdf1083bc63a6f10d14e82",
      "sourceUnitDigest": "78b93c88e219b1c9",
      "targetOwner": null,
      "targetAnchor": null,
      "claimKind": "navigation",
      "disposition": "unknown-blocking",
      "reviewStatus": "blocking",
      "rationale": "Document title of the legacy plan; no target section carries this plan as such (targets are split by release proof, not by this plan title).",
      "searched": [
        "grep -iF \"Rust Host And Proof Providers\" over all markdown files under docs/platform/host-invocation-routing/ (excluding forbidden names): no matching claim",
        "grep -iF \"Implementation Plan\" over all markdown files under docs/platform/host-invocation-routing/ (excluding forbidden names): no matching claim",
        "grep -iF \"Proof Providers\" over all markdown files under docs/platform/host-invocation-routing/ (excluding forbidden names): no matching claim"
      ]
    },
    {
      "claimId": "claim_182dc1f2f896d82f0cf35519579ebbbf",
      "sourceUnitDigest": "bbf58c843d814796",
      "targetOwner": "docs/platform/host-invocation-routing/architecture/release-boundaries.md",
      "targetAnchor": "2-open-release-decisions",
      "claimKind": "historical-context",
      "disposition": "supersede",
      "reviewStatus": "pending",
      "rationale": "Source header states status \"proposed, blocked only by remaining section 3 decisions and the fgctl walking skeleton\", dated 2026-09-04/10. Target states R1/R2/R3 implemented preview with preview approved and compatibility window set; the proposed-status framing, revision note and the architecture/migration/component-boundary link list are not reproduced as a header."
    },
    {
      "claimId": "claim_c710c879488536d7a2b949141952f010",
      "sourceUnitDigest": "1aef0de67780feeb",
      "targetOwner": null,
      "targetAnchor": null,
      "claimKind": "intent",
      "disposition": "unknown-blocking",
      "reviewStatus": "blocking",
      "rationale": "States this document owns execution order, deliverables, gates, verification and rollback while contracts/lifecycle/authority/framing/registry/compat modes/trade-offs are owned by the architecture doc and not redefined here. No target states this scope split for the plan.",
      "searched": [
        "grep -iF \"intentionally not redefined\" over all markdown files under docs/platform/host-invocation-routing/ (excluding forbidden names): no matching claim",
        "grep -iF \"execution order\" over all markdown files under docs/platform/host-invocation-routing/ (excluding forbidden names): no matching claim",
        "grep -iF \"not redefined here\" over all markdown files under docs/platform/host-invocation-routing/ (excluding forbidden names): no matching claim",
        "grep -iF \"deliverables, gates\" over all markdown files under docs/platform/host-invocation-routing/ (excluding forbidden names): no matching claim"
      ]
    },
    {
      "claimId": "claim_d4b9b2583e0b4b598a7610af9ced7d36",
      "sourceUnitDigest": "c00dc23b0e512e53",
      "targetOwner": null,
      "targetAnchor": null,
      "claimKind": "navigation",
      "disposition": "archive-with-reason",
      "reviewStatus": "pending",
      "rationale": "Heading of a migration pointer note (\"legacy-current execution-plan source during the 2026-09-14 promotion pass\"); its job (point to promoted docs) is done by the target docs themselves and area README section 8, so the note is obsolete navigation."
    },
    {
      "claimId": "claim_bb1dcfee5986a94c37e667c75bd3af84",
      "sourceUnitDigest": "9e7bbb0c3bb08918",
      "targetOwner": null,
      "targetAnchor": null,
      "claimKind": "navigation",
      "disposition": "archive-with-reason",
      "reviewStatus": "pending",
      "rationale": "Pointer list naming release-boundaries, compatibility-harness and r1/r2/r3 proof docs as the promoted successors; the source says it only applies \"during the 2026-09-14 promotion pass\". Those targets now exist and each links back to the source plan, so this navigation no longer applies."
    },
    {
      "claimId": "claim_43c25aed966fdb607de17ca47cbce862",
      "sourceUnitDigest": "a52bf71926ba8686",
      "targetOwner": "docs/platform/host-invocation-routing/architecture/release-boundaries.md",
      "targetAnchor": "1-release-boundaries",
      "claimKind": "architecture",
      "disposition": "merge",
      "reviewStatus": "pending",
      "rationale": "Heading of the three-release outcome; the R1/R2/R3 release definitions live in the release boundaries section (different title, same content)."
    },
    {
      "claimId": "claim_a29012c7fb94f83828b7835413eebcc2",
      "sourceUnitDigest": "62f374c5546f8bcb",
      "targetOwner": "docs/platform/host-invocation-routing/architecture/release-boundaries.md",
      "targetAnchor": "unheaded-block-2",
      "claimKind": "architecture",
      "disposition": "merge",
      "reviewStatus": "pending",
      "rationale": "Three independently shippable releases (R1, R2, R3) are the rows of the release boundaries table."
    },
    {
      "claimId": "claim_ab6683864cea05c444f1b78cd30475b9",
      "sourceUnitDigest": "e0c70d6e826e2c96",
      "targetOwner": "docs/platform/host-invocation-routing/verification/r1-rust-host-proof.md",
      "targetAnchor": "1-required-proof",
      "claimKind": "architecture",
      "disposition": "supersede",
      "reviewStatus": "pending",
      "rationale": "R1 (Rust installed entry, unmigrated CLI reaches Node, native version, install/init/doctor/upgrade/rollback/uninstall reproducible via fgctl), R2 (fixture proves framed protocol, no marketplace) and R3 (route calls shared service, no CLI/fgos.v1) are carried across r1 proof section 1, r2 proof sections 1/7 and r3 proof section 1. Differs: the target drops the split \"install/upgrade/rollback/uninstall via fgctl; init/doctor local under the active identity\" and does not say R2 avoids a full plugin marketplace as an outcome statement (only as non-gate)."
    },
    {
      "claimId": "claim_a411676b68cace20da24d92621ed8925",
      "sourceUnitDigest": "32389e1a464f6b37",
      "targetOwner": "docs/platform/host-invocation-routing/architecture/release-boundaries.md",
      "targetAnchor": "unheaded-block-4",
      "claimKind": "decision",
      "disposition": "supersede",
      "reviewStatus": "pending",
      "rationale": "Target row \"R2 and R3 do not delay R1 installed-entry flip\" carries the main claim. Differs: \"R1 is useful without R2 or R3\" and \"R2 and R3 may start after the R1 runtime kernel is stable\" are not stated."
    },
    {
      "claimId": "claim_e8dfeedeba14914888b827064f151fa9",
      "sourceUnitDigest": "2934016a2bd6d77f",
      "targetOwner": "docs/platform/host-invocation-routing/architecture/release-boundaries.md",
      "targetAnchor": "unheaded-block-2",
      "claimKind": "decision",
      "disposition": "supersede",
      "reviewStatus": "pending",
      "rationale": "Heading of the non-goals list; closest target is the \"Explicitly not a gate\" column of the release table (see next row for what differs)."
    },
    {
      "claimId": "claim_cde3d5a31e679710c732f892d197b7ef",
      "sourceUnitDigest": "8fef48718a84f098",
      "targetOwner": "docs/platform/host-invocation-routing/architecture/release-boundaries.md",
      "targetAnchor": "unheaded-block-2",
      "claimKind": "decision",
      "disposition": "supersede",
      "reviewStatus": "pending",
      "rationale": "Non-goals: WASM/marketplace/signatures and core-provider replacement are carried (release table non-gates, r2 proof section 7), repository-wide Node thinning rejected (node-to-rust-migration). Differs/absent: no Work Lifecycle writer/runner/coordination migration non-goal as such, no \"no Node deletion in the same change that flips its binding\", no \"no Rust toolchain or hidden lifecycle build on consuming projects\", no \"no speculative chat adapter\" rule."
    },
    {
      "claimId": "claim_ab778e44a43171006f82c08d9939dcf5",
      "sourceUnitDigest": "2c11291e0dae8db8",
      "targetOwner": "docs/platform/host-invocation-routing/architecture/release-boundaries.md",
      "targetAnchor": "2-open-release-decisions",
      "claimKind": "decision",
      "disposition": "merge",
      "reviewStatus": "pending",